{
  "artifact_type": "consolidated_corpus_unresolved_v1",
  "format_version": 1,
  "summary": {
    "conflict_count": 1,
    "remainder_count": 1
  },
  "conflicts": [
    {
      "category": "scalar_field_conflict",
      "identity": "work:work_example_1954",
      "field": "date",
      "reason": "Two nonidentical dates cannot be selected automatically.",
      "occurrences": [
        {
          "source": {
            "batch_id": "example-batch-1",
            "container": "example-1.json"
          },
          "json_pointer": "/works/0/date",
          "value": "1954"
        },
        {
          "source": {
            "batch_id": "example-batch-2",
            "container": "example-2.zip",
            "member": "batch.json"
          },
          "json_pointer": "/works/0/date",
          "value": {
            "from": "1954",
            "to": "1955"
          }
        }
      ]
    }
  ],
  "remainders": [
    {
      "category": "unsupported_field",
      "reason": "The product schema has no lossless field for this value.",
      "source": {
        "batch_id": "example-batch-1",
        "container": "example-1.json"
      },
      "json_pointer": "/works/0/review_note",
      "value": {
        "status": "needs specialist review",
        "suggestions": [
          "compare catalogues",
          "confirm release date"
        ]
      },
      "dependencies": [
        "/works/0"
      ]
    }
  ]
}
